Unique_ID,State,District,Disease,Cases,Deaths,Start_Date,Report_Date,Status,Comments
TL/HYD/2022/14/130,Telangana,Hyderabad,Diarrheal,95,00,08-04-22,07-04-22,Under Control,
HR/MWT/2022/14/132,Haryana,Nuh,Measles,09,00,23-03-22,samples,tested positive,for Measles. Among all of the cases
KN/CKR/2022/14/133,Karnataka,Chikkaballapura,Chickenpox,17,00,27-03-22,RRT,investigated the,outbreak and house to house survey
AR/ESN/2019/25/0691,East,Siang,Fever,29,00,18-06-19,19-06-19,JE tested,at DPHL Pasighat. Necessary advice for
GJ/AHM/2019/25/0693,Gujarat,Ahmedabad,Diarrheal,34,00,24-06-19,25-06-19,stool sample,taken and sent to Sola Civil
HR/PNP/2019/25/0694,Haryana,Panipat,Measles,07,00,19-06-19,24-06-19,outbreak. 5,blood samples taken and sent to
KN/HAS/2019/25/0698,Karnataka,Hassan,Dengue,11,00,17-06-19,18-06-19,collected of,"which one was positive for Dengue,"
KN/TUM/2019/25/0699,Karnataka,Tumkur,Fever,22,00,16-06-19,18-06-19,1 blood,sample was subjected to culture and
KL/WYN/2019/25/0703,Kerala,Wayanad,Dengue,17,00,17-06-19,19-06-19,for Dengue,by NS1 Ag. It was observed that
NL/ZNB/2019/25/0706,Nagaland,Zunheboto,Chickenpox,05,00,17-06-19,18-06-19,rash and,body ache. Diagnosis made on clinical
WB/BWN/2019/25/0711,West,Bengal,Burdwan Diarrheal,40,00,23-06-19,24-06-19,sample. Block,RRT visited the area And
AS/DAR/2019/25/0712,Assam,Multiple,districts AES,1350,177,25-05-19,smears,were examined,of which 238 were positive for P
AS/DBG/2019/25/0713,Assam,Dibrugarh,Diarrheal,70,00,15-06-19,found,positive for,Shigella Flexineri by Culture. 1 water
JH/ESI/2019/25/0719,Jharkhand,East,Singhbhum Dengue,08,00,15-06-19,Samples,found positive,for Dengue by IgM ELISA. DRRT
KN/CMN/2019/25/0721,Karnataka,Chamarajanagar,Chikungunya,32,00,15-06-19,was,found. Indoor,breeding was also observed during house
KN/DKK/2019/25/0722,Karnataka,Hepatitis,E,10,00,10-06-19,vomiting,along with,Jaundice. A total of 4 blood samples
Encephalitis,Surveillance,patients,are above the age of,15,67,blood,samples,,
OR/BSR/2019/25/0728,Odisha,Balasore,Jaundice,07,00,10-06-19,with,sewage line.,04 Water samples collected from Govt.
RJ/BAA/2019/25/0729,Rajasthan,Baran,Hepatitis,06,00,14-06-19,found,positive for,Hepatitis E by IgM ELISA. 9 water
house,to,house,survey. Out of,13,7,were,male,and 6,
AP/WSN/2022/19/224,West,Siang,Food Poisoning,03,00,09-05-2022,13-05-2022,Under Control,survey was conducted. All cases were given
AS/NGO/2022/19/225,Assam,Nagaon,Leptospirosis,02,00,07-05-22,09-05-22,Under Control,
BH/SUP/2022/19/226,Bihar,Supaul,Food Poisoning,23,00,10-05-22,14-05-22,Under Control,
CT/GID/2022/19/227,Chhatisgarh,Gariyaband,Diarrheal,33,00,13-05-2022,14-05-2022,Under Control,Enteropathogenic organism was found.in the
GJ/NAV/2022/19/229,Gujarat,Navsari,Diarrheal,47,00,15-05-2022,15-05-2022,Under Control,
GJ/SRD/2022/19/230,Gujarat,Surendranagar,Hepatitis A,46,00,10-05-2022,11-05-2022,Under Control,water samples were found unfit for drinking.
JK/ANG/2022/19/234,Anantnag,Hepatitis,A,26,00,13-05-2022,14-05-2022,Under Control,
JH/DMK/2022/19/236,Jharkhand,Dhumka,Chickenpox,28,00,11-05-22,11-05-22,Under Control,
KN/HAS/2022/19/237,Karnataka,Hassan,Diarrheal,20,00,09-05-22,11-05-22,Under Control,organism was found in any of the samples stool
KN/GUL/2022/19/238,Karnataka,Kalaburgai,Cholera,144,00,07-05-22,09-05-22,Under Control,
KN/TUM/2022/19/239,Karnataka,Tumkur,Diarrheal,13,00,13-05-22,20-05-22,Under Control,
KL/MLP/2022/19/242,Kerala,Malappuram,Hepatitis A,20,00,14-04-22,09-05-22,positive for,Hepatitis A on IgM ELISA. District
KL/WYN/2022/19/244,Kerala,Wayanad,Food Poisoning,47,00,08-05-22,12-05-22,analysis. Water,samples were found to be
MH/JGA/2022/19/248,Maharashtra,Jalgaon,Dengue,09,01,06-05-2022,11-05-2022,Under Control,a 13 year old male. District RRT investigated the
MH/NAS/2022/19/249,Maharashtra,Nashik,Chikungunya,06,00,09-05-2022,10-05-2022,Under Control,investigated the outbreak. And fever survey was
OR/GJM/2022/19/250,Odisha,Ganjam,Diarrheal,22,00,10-05-22,16-05-22,Under Control,"DPHL, DHH. Result awaited. District RRT"
PB/JAL/2022/19/251,Punjab,Jalandhar,Chickenpox,16,00,10-05-2022,13-05-2022,Under Control,found to be negative. District RRT investigated
PB/NWS/2022/19/252,Punjab,S.A.S,Nagar Diarrheal,18,00,11-05-2022,12-05-2022,Under Control,
RJ/BKN/2022/19/253,Rajasthan,Bikaner,Diarrheal,27,00,12-05-2022,13-05-2022,Under Control,response team surveyed the affected area and
TN/KRI/2022/19/254,Tamil,Nadu,Krishnagiri,12,00,15-05-22,16-05-22,Under Control,Krishnagiri. Two samples tested positive for
TN/TPL/2022/19/255,Tamil,Nadu,Tiruchirappalli Food Poisoning,12,00,09-05-22,16-05-22,Under Control,
TN/TTK/2022/19/256,Tamil,Nadu,Thoothukudi Hepatitis A,05,00,11-05-22,15-05-22,Under Control,
TN/VEL/2022/19/257,Tamil,Nadu,Vellore Diarrheal,15,00,06-05-2022,11-05-2022,Under Control,found to be nonpotable. District RRT investigated
UP/LKW/2022/19/258,Uttar,Pradesh,Lucknow Chickenpox,06,00,12-05-2022,13-05-2022,Under Control,all the cases were given symptomatic treatment.
WB/JLP/2022/19/259,West,Bengal,Jalpaiguri Dengue,272,00,08-05-22,08-05-22,samples were,found positive for Dengue. District
WB/SPG/2022/19/261,West,Bengal,Cholera,60,00,12-05-22,13-05-22,of three,stool samples showed growth of V.
HR/YNN/2022/19/262,Haryana,Yamuna,Nagar Food Poisoning,20,00,11-05-22,water,samples were,found to be potable using MPN method.
KN/TUM/2022/19/269,Karnataka,Tumakuru,Rabies,01,01,04-05-22,bitten,by pet,dog on 14.04.2022. Case had symptomsof
MH/SIN/2022/19/271,Maharashtra,Malaria,(PV),05,00,04-05-22,found,positive for,Malaria.District RRT investigated the
UK/NAI/2022/19/272,Uttarakhand,Nainital,Measles,08,02,24-04-22,ELISA.The,two deceased,cases were 4 years old male and 2
CT/RPR/2020/19/302,Chhattisgarh,Raipur,Hepatitis E,65,00,03-04-20,College.,Of the,132 blood samples 09 were found to be positive
GJ/SRT/2020/19/03,Gujarat,Surat,Chickenpox,14,00,17-04-20,case,search conducted.,Cases presented with fever and
KL/PTH/2020/19/304,Kerala,Pathanamthitta,Dengue,18,00,03-04-20,rubber,"plants, breeding",sited identified in the plantation area
Dengue,by,IgM,ELISA and,17,1,card,test.,All,
KL/KTM/2020/19/306,Kerala,Kottayam,Hepatitis A,13,00,20-02-20,Most,cases were,below 20 years of age. Lab samples collected
TL/WPY/2020/19/307,Telangana,Wanaparthy,Dengue,73,00,06-04-20,"ache,",headache and,chills. Cases were among daily wage labors
Under,area.,A,total of,04,23,water,samples,,
PB/NWS/2020/23/337,Punjab,Nawanshahr,Diarrhoeal,37,00,04-06-20,05-06-20,loose stools,and vomiting. Lab samples collected
TN/TRN/2020/23/338,Tamil,Nadu,Chikungunya,25,00,05-06-20,09-06-20,sites observed.,A total of 11 serum samples
TN/DDG/2020/23/339,Tamil,Nadu,Dindigul-Palani Dengue,57,00,07-06-20,09-07-20,sewage contamination,observed. A total of 06
AR/WSN/2023/26/607,West,Siang,Mushroom,16,00,26-06-2023,27-06-2023,Naharlaguan. District,RRT investigated the
CT/BLD/2023/26/616,Chhattisgarh,Balod,diarrheal,65,00,01-07-2023,02-07-2023,outbreak. Cases,were treated with ORS and
CT/BBR/2023/26/617,Chhattisgarh,Baloda,Bazar Diarrheal,47,00,28-06-2023,28-06-2023,District RRT,investigated the outbreak. Cases
GJ/AND/2023/26/620,Gujarat,Anand,Diarrheal,07,00,25-06-2023,26-06-2023,the area.,Stool sample did not show any
GJ/DAH/2023/26/621,Gujarat,Dohad,Diarrheal,39,00,26-06-2023,26-06-2023,Limkheda. District,RRT investigated the
GJ/GSN/2023/26/622,Gujarat,Gir,Somnath Diarrheal,73,00,24-06-2023,27-06-2023,after eating,lunch in Shishu Mandir school.
GJ/JGH/2023/26/623,Gujarat,Junagadh,Diarrheal,45,00,30-06-2023,30-06-2023,‘vagharel roti’,(fried roti) during breakfast in
JH/DEO/2023/26/627,Jharkhand,Deoghar,Diarrheal,11,00,24-06-2023,26-06-2023,developed the,symptoms after consumption of
JH/KUT/2023/26/628,Jharkhand,Khunti,Chickenpox,06,00,01-07-2023,01-07-2023,group were,6-35 years. Result came positive
JH/WSI/2023/26/629,Jharkhand,West,Singhbhum Malaria,85,00,02-07-2023,02-07-2023,cases 17,were found positive for Plasmodium
KN/BEL/2023/26/630,Karnataka,Ballari,Diarrheal,43,00,28-06-2023,29-06-2023,outbreak. 3,water samples were found not
KN/UDU/2023/26/635,Karnataka,Udupi,Diarrheal,11,00,23-06-2023,27-06-2023,Manipal. District,RRT investigated the
KN/VIJ/2023/26/636,Karnataka,Vijayanagar,Diarrheal,54,00,01-07-2023,01-07-2023,VIMS Ballari.,District RRT investigated the
KL/MLP/2023/26/641,Kerala,Malappuram,Monkey pox,01,00,22-06-23,26-06-2023,Case is,"a 42-year-old male, who has a history"
KL/PTH/2023/26/643,Kerala,Pathanamthitta,Dengue,18,01,25-06-23,25-06-23,Out of,18 samples 6 came positive for Dengue
MH/PNE/2023/26/651,Maharashtra,Pune,Dengue,05,01,20-06-2023,28-06-2023,two samples,found positive for Dengue IgM
MG/JTH/2023/26/653,Meghalaya,East,Jaintia Hills Diarrheal,04,00,26-06-2023,27-06-2023,,
WB/DKJ/2023/26/658,West,Bengal,Dinajpur Dakshin Diarrheal,06,00,27-06-2023,27-06-2023,Kolkata. District,RRT investigated the
BH/GYA/2023/26/659,Bihar,Gaya,Measles,04,00,12-06-2023,to,6 yrs.,One sample found positive for Measles IgM by
MH/THN/2023/26/665,Maharashtra,Thane,Dengue,08,01,10-06-2023,test.,House to,house survey was done. Many vector breeding
JH/DHN/2020/02/0021,Jharkhand,Dhanbad,Chickenpox,10,00,07-01-20,08-01-20,RRT investigated,the outbreak. Active search of
KN/BGK/2020/02/0023,Karnataka,Bagalkote,Chikungunya,33,00,24-01-19,28-01-20,collected; 3,samples were positive for
KN/CKM/2020/02/0025,Karnataka,Chikkamagaluru,Hepatitis A,22,00,07-01-20,10-01-20,was found,positive for HAV (Ig M ELISA). All
KL/ERN/2020/02/0028,Kerala,Ernakulam,Mumps,09,00,01-01-20,04-01-20,RRT investigated,the outbreak. Active search of
KL/PTH/2020/02/0033,Kerala,Pathnamathitta,Hepatitis A,54,00,24-11-19,survey,done. Out,of 3 blood samples collected; 1 sample was
JH/SBG/2022/13/104,Jharkhand,Sahibganj,Measles,63,00,16-12-21,29-03-22,Under Control,
JH/GDA/2022/13/105,Jharkhand,Godda,Measles,02,00,29-03-22,30-03-22,Under Control,
KL/IDK/2022/13/110,Kerala,Idukki,Food Poisoning,12,00,28-03-22,02-04-22,Under Control,Water sample collected and was sent to PH Lab
KN/DVA/2022/13/111,Karnataka,Davanagere,Diarrheal,21,00,27-03-22,28-03-22,Under Control,
KN/KPP/2022/13/112,Karnataka,Koppal,Food Poisoning,50,00,29-03-22,30-03-22,Under Control,
OR/KPT/2022/13/114,Odisha,Koraput,Diarrheal,09,01,04-03-22,04-04-22,****** were,found to be nonpotable and no
OR/GJM/2022/13/115,Odisha,Ganjam,Diarrhoeal,83,00,05-04-22,07-04-22,Under Control,
OR/GJM/2022/13/116,Odisha,Ganjam,Diarrhoeal,69,00,03-04-22,04-04-22,Under Control,
OR/KPT/2022/13/117,Odisha,Koraput,Diarrhoeal,08,00,28-03-22,29-03-22,Under Control,in any of the stool samples and Out of the five
PB/NWS/2022/13/118,Punjab,Nawanshahr,Hepatitis-A,207,0,28-03-22,28-03-22,be reactive,on ELISA for Hepatitis A Out of 10
TN/PUD/2022/13/121,Tamil,Nadu,Pudukkottai Dengue,15,00,30-03-22,30-03-22,Under Control,positive for Dengue IgM and two for Dengue
TN/KRI/2022/13/122,Tamil,Nadu,Krishnagiri Food Poisoning,18,00,31-03-22,01-04-22,Under Control,growth was found in the food sample and the
TL/JIL/2022/13/124,Telangana,Jagtial,Food Poisoning,25,00,02-04-22,03-04-22,Under Control,
UK/HDW/2022/13/125,Uttarakhand,Haridwar,Food Poisoning,89,00,03-04-22,04-04-22,Under Control,Enteropathogenic organism was found in any of
AS/BON/2023/27/668,Assam,Bongaigaon,Dog Bite,01,01,01-07-23,04-07-23,deteriorated on,27/6/23. The case a 12 year
AS/DHE/2023/27/669,Assam,Dhemaji,Diarrheal,85,00,07-07-23,07-07-23,to DPHL,Dhemaji. The reports showed no
AS/SBG/2023/27/670,Assam,Dibrugarh,Diarrheal,05,00,01-07-23,07-07-23,awareness and,health education given by
CT/BLD/2023/27/674,Chhattisgarh,Balod,Diarrheal,24,00,03-07-23,04-07-23,investigated the,outbreak. Community
GJ/AVL/2023/27/676,Gujarat,Arvalli,Diarrheal,05,00,04-07-23,04-07-23,awareness and,health education given by
GJ/BNS/2023/27/677,Gujarat,Banaskantha,Diarrheal,06,01,05-07-23,06-07-23,sanitation. Active,surveillance was done in
GJ/BNS/2023/27/678,Gujarat,Banaskantha,Diarrheal,16,00,06-07-23,06-07-23,RRT investigated,the outbreak. Community
HR/RUP/2023/27/684,Haryana,Nuh,Chickenpox,22,00,05-07-23,05-07-23,fever survey,was done. Majority of cases were
KN/VIJ/2023/27/692,Karnataka,Vijayapura,Rabies,01,01,06-07-23,06-07-23,have been,given Vaccine. House to house
MH/KOP/2023/27/697,Maharashtra,Kolhapur,Dengue,44,00,07-07-23,07-07-23,given by,peripheral team on the importance of
MH/NAN/2023/27/699,Maharashtra,Nanded,Diarrhoeal,26,00,30-06-23,03-07-23,outbreak. Community,awareness and health
MH/STA/2023/27/700,Maharashtra,Satara,Chikungunya,06,00,03-07-23,06-07-23,was done.,"Emptied water containers,"
TN/NMK/2023/27/702,Tamil,Nadu,Namakkal Diarrheal,69,00,02-07-23,03-07-23,2 water,samples were found to be positive for
of,fever,with,rash.,5,5,throat,swab,,
were,in,the,age group of,1,10,years.,All,,
TL/WPY/2023/27/704,Telangana,Wanaparthy,Diarrheal,58,00,07-07-23,07-07-23,Found in,12 Stool and Urine Samples. Normal
KL/MLP/2023/27/709,Kerala,Malappuram,Leishmaniasis,07,00,13-06-23,District,RRT investigated,the outbreak. Health education was
ELISA,"testing,",out,of,9,5,were,found,to be,positive
MG/WKH/2023/27/713,Meghalaya,Scrub,Typhus,09,00,04-06-23,investigated,the outbreak.,"Source reduction activities, fever"
AS/TIN/2019/31/0955,Assam,Tinsukia,Diarrheal,10,00,03-08-19,03-08-19,and sent,to AMCH Microbiology for MNP and
BH/MNG/2019/31/0956,Bihar,Munger,Food,23,00,30-07-19,03-08-19,of consuming,food in a religious ceremony. All
RJ/PAL/2019/31/0964,Rajasthan,Pali,Diarrheal,15,00,31-07-19,01-08-19,abdomen and,loose motions. A total of 09 stool
TR/GOT/2019/31/0966,Tripura,Gomati,Jaundice,36,00,28-07-19,28-07-19,a common,overhead tank. Water samples were
AS/GLP/2019/31/0970,Assam,Goalpara,Hepatitis A,18,00,15-07-19,village.,A total,of 05 serum and 05 water samples were
BH/VSH/2019/31/0971,Bihar,Vaishali,Mumps,06,00,19-06-19,group,3 to,5 years. A total of 4 blood samples were collected
RJ/BAA/2019/31/0985,Rajasthan,Baran,Diarrheal,61,00,25-07-19,M.B.S,Hospital Kota,and all found positive for Escherichia
UP/GON/2019/31/0987,Uttar,Pradesh,Gonda Diarrheal,15,01,20-07-19,outbreak.,Cases presented,"with loose stools, vomiting and"
GJ/KAJ/2022/50/988,Gujarat,Anand,Diarrheal,25,0,17-12-2022,17-12-2022,unsatisfactory for,drinking with isolation of
KL/KAJ/2022/50/992,Kerala,Ernakulam,Food Poisoning,31,00,11-12-22,12-12-22,samples collected,and sent to Regional
KL/KAJ/2022/50/994,Kerala,Malappuram,Hepatitis A,49,00,11-11-22,19-12-22,loose motions.,Six samples collected and sent
KN/KAJ/2022/50/997,Karnataka,Chikkaballapura,Rabies,04,01,30-10-22,sample,collected and,sent to NIV Bengaluru result negative.
KL/KAJ/2022/50/998,Kerala,Palakkad,Food Poisoning,13,00,07-12-22,with,vomiting and,loose motions. Water samples collected and
AS/DHE/2023/28/718,Assam,Dhemaji,Diarrheal,85,00,07-07-23,11-07-23,consumed Prasad,in a ritual function. Water
the,age,group,of,1,10,years.,Sample,,
BH/PTN/2023/28/722,Bihar,Patna,Malaria,04,00,07-07-23,10-07-23,Vivax and,1 for Plasmodium Falciparum) on
GJ/MHS/2023/28/723,Gujarat,Mahesana,Diarrheal,56,00,13-07-23,13-07-23,investigated the,outbreak. Stool samples were
KN/CHI/2023/28/731,Karnataka,Chitradurga,Diarrheal,34,00,12-07-23,14-07-23,the outbreak.,Stool culture did not show growth
KN/GUL/2023/28/732,Karnataka,Kalaburagi,Diarrheal,10,00,10-07-23,11-07-23,did not,show growth of any pathogens. Three
KN/KPP/2023/28/733,Karnataka,Koppal,Chikungunya,38,00,14-07-23,14-07-23,sample found,positive for IgM Chikungunya by
KN/TUM/2023/28/735,Karnataka,Tumkur,Diarrheal,25,00,14-07-23,16-07-23,investigated the,outbreak. Two out of eight
KL/ERN/2023/28/736,Kerala,Ernakulam,Dengue,252,00,11-07-23,16-07-23,IgM by,ELISA test at DPHL Ernakulum.
KL/WYN/2023/28/737,Kerala,Wayanad,Chickenpox,27,00,08-07-23,10-07-23,investigated the,outbreak. House to house
MH/PLR/2023/28/742,Maharashtra,Palaghar,Dengue,12,00,15-07-23,15-07-23,samples found,positive for IgM Dengue by
MH/SIN/2023/28/743,Maharashtra,Sindhudurg,Diarrheal,30,00,12-07-23,12-07-23,outbreak. All,5 samples found fit for potable
MN/IMP/2023/28/745,Manipur,Imphal,West Dengue,65,00,13-07-23,15-07-23,survey was,conducted and treated
OR/CUT/2023/28/749,Odisha,Cuttack,Diarrheal,26,00,15-07-23,15-07-23,symptoms after,consuming food from canteen.
TN/NMK/2023/28/751,Tamil,Nadu,Namakkal Unknown,17,00,11-07-23,13-07-23,outbreak. Result,of samples came negative for
WB/MRS/2023/28/755,West,Bengal,Murshidabad,32,00,15-07-23,16-07-23,cases have,history of consumption of food at
WB/MRS/2023/28/756,West,Bengal,Murshidabad,22,00,16-07-23,17-07-23,consumption of,food at a marriage ceremony.
KL/TRC/2023/28/760,Kerala,Thrissur,West Nile,01,01,09-06-23,IgM,West Nile,Virus by ELISA. 60-Year-old female
WB/MRS/2023/28/761,West,Bengal,Murshidabad Anthrax,02,00,04-05-23,MCH.,District RRT,investigated the outbreak. Sample came
CT/KAW/2019/34/1048,Chhattisgarh,Kawardha,Diarrheal,09,00,21-08-19,23-08-19,cases survey,done. All cases treated symptomatically.
GJ/AND/2019/34/1049,Gujarat,Anand,Diarrheal,40,00,19-08-19,20-08-19,cases survey,done. 2 Stool sample collected and sent to
KL/ERN/2019/34/1054,Kerala,Ernakulam,Dengue?,15,00,19-08-19,03-08-19,cases survey,done. All cases treated symptomatically.
OR/BSR/2019/34/1062,Odisha,Balasore,Diarrheal,10,00,20-08-19,21-08-19,cases were,found to be non-potable. All cases treated
PB/FTH/2019/34/1065,Punjab,Fatehghar,Saheb Diarrheal,43,00,22-08-19,22-08-19,cases,
BH/NLD/2019/34/1070,Bihar,Nalanda,Diarrheal,33,00,13-07-19,cases,survey done.,All cases treated symptomatically. Halogen
BH/SHK/2019/34/1071,Bihar,Shekhpura,Diarrheal,18,00,13-08-19,cases,house survey,done. All cases treated symptomatically. Halogen
CT/JAN/2019/34/1072,Chhattisgarh,Janjgir,Diarrheal,39,00,13-08-19,cases,result awaited.,Temporary medical camps organized in the
JH/ESI/2019/34/1073,Jharkhand,East,Singhbhum,35,00,20-07-19,to,RIMS Ranchi;,4 samples were positive for Hepatitis E (IgM
MH/STA/2019/34/1076,Maharashtra,Satara,Dengue,15,00,10-08-19,cases,collected; 9,samples were positive for Dengue (IgM ELISA).
AS/KOK/2023/29/771,Assam,Kokrajhar,Malaria,115,00,20-07-23,21-07-23,samples were,sent to Balajan BPHC which
AS/NGO/2023/29/773,Assam,Nagaon,Encephalitic,04,01,17-07-23,21-07-23,"Negative, 1",was Equivocal and 1 was found to
BH/PTN/2023/29/775,Bihar,Patna,Diarrheal,35,01,17-07-23,17-07-23,outbreak might,"be due to broken pipeline,"
GJ/AND/2023/29/776,Gujarat,Anand,Jaundice,20,00,21-07-23,21-07-23,tested for,hepatitis were non-reactive (by rapid
JH/JAT/2023/29/780,Jharkhand,Jamtara,Chickenpox,06,00,17-07-23,20-07-23,Varicella zoster,virus (VZV). Symptomatic
JH/LOH/2023/29/782,Jharkhand,Lohardaga,Chickenpox,05,00,18-07-23,18-07-23,positive for,IgM VZV (Varicella zoster virus).
JH/WSI/2023/29/784,Jharkhand,West,Singhbhum Chickenpox,05,00,22-07-23,22-07-23,out of,which two samples came positive for
group,is,in,between,12,16,Years.,4,water,
KN/CMN/2023/29/785,Karnataka,Chamarajanagar,Others,25,00,16-07-23,18-07-23,samples were,"tested at PHC Horehala, in"
KN/HAV/2023/29/786,Karnataka,Haveri,Diarrheal,17,00,18-07-23,19-07-23,samples were,found to be SPP (suitable for
KN/TUM/2023/29/788,Karnataka,Tumkur,Diarrheal,33,00,16-07-23,17-07-23,pathogens and,6 water samples were NSPP
MH/OSM/2023/29/796,Maharashtra,Osmanabad,Dengue,07,00,22-07-23,22-07-23,sent to,"GMC Solapur, out of which 4 were"
TN/CMBN/2023/29/798,Tamil,Nadu,Coimbatore Chickenpox,14,00,14-07-23,15-07-23,between 5-10,years. District RRT investigated
TN/TNJ/2023/29/800,Tamil,Nadu,Thanjavur Hepatitis A,18,00,18-07-23,18-07-23,,
TN/TPL/2023/29/801,Tamil,Nadu,Tiruchirappalli Hepatitis A,29,00,17-07-23,31-07-23,,
rash.,Affected,age,group is in between,9,6,years.,5,,
Under,Kanjirappally,for,testing. Among the,7,3,cases,were,,
cases,were,in,the age group of,15,24,years.,District,RRT,
TN/TRR/2023/29/812,Tamil,Nadu,Tiruppur Dengue,27,00,25-06-23,leptospira.,District RRT,investigated the outbreak. Health
BH/JAH/2021/10/0117,Bihar,Jahanabad,Chicken Pox,13,00,07-03-21,12-03-21,fever and,papulo-vesicular rashes. 03 blood
MH/KOP/2021/10/0118,Maharashtra,Kolhapur,Chikungunya,06,00,10-03-21,10-03-21,out of,which 06 samples found positive for
TN/MDR/2021/10/0119,Tamil,Nadu,Madurai Diphtheria,01,01,07-03-21,09-03-21,analysis to,"State Public Health Lab., DMS"
BH/GYA/2023/30/815,Bihar,Gaya,Diarrheal,13,00,26-07-23,28-07-23,outbreak. House,to house survey was
BH/SAR/2023/30/816,Bihar,Saharsa,Measles,11,00,24-07-23,25-07-23,conducted and,treated symptomatically. Two
KN/BDR/2023/30/826,Karnataka,Bidar,Diarrheal,16,00,29-07-23,29-07-23,survey was,conducted and treated
KN/BDR/2023/30/827,Karnataka,Bidar,Diarrheal,19,00,29-07-23,30-07-23,House to,house survey was conducted and
KK/IDK/2023/30/829,Kerala,Idukki,Diarrheal,27,00,25-07-23,30-07-23,RRT investigated,the outbreak. House to house
MH/AMR/2023/30/833,Maharashtra,Amravati,Diarrheal,42,00,27-07-23,28-07-23,cases developed,the symptoms after
MH/BNR/2023/30/835,Maharashtra,Bhandara,Dengue,30,00,27-07-23,27-07-23,Bhandara. District,RRT investigated the
MH/OSM/2023/30/837,Maharashtra,Osmanabad,Dengue,9,00,26-07-23,26-07-23,investigated the,outbreak. One blood sample
TN/TVR/2023/30/841,Tamil,Nadu,Thiruvarur Leptospirosis,42,01,22-07-23,26-07-23,camp was,conducted in a school with around
UP/ADK/2023/30/843,Ambedkar,Nagar,Chickenpox,10,00,24-07-23,26-07-23,survey was,conducted and treated
BH/BAN/2023/30/847,Bihar,Banka,Diarrheal,25,00,20-07-23,vomiting.,District RRT,investigated the outbreak. House to
CT/BBR/2023/30/848,Chhattisgarh,Baloda,Bazar Diarrheal,10,00,17-07-23,investigated,the outbreak.,House to house survey was
JK/RAI/2023/30/851,Reasi,Hepatitis,A,27,00,12-07-23,House,to house,surveys for active case finding were conducted.
JH/DEO/2023/30/852,Jharkhand,Deoghar,Malaria,03,00,19-07-23,conducted,and treated,symptomatically. All samples found
MG/RIB/2023/30/856,Meghalaya,Ri,Bhoi Diarrheal,46,00,19-07-23,the,outbreak. All,the cases developed the symptoms after
Surveillance,ORS,"solution,",Zinc solution.,39,167,samples,came,,
TN/CMB/2023/30/858,Tamil,Nadu,Coimbatore Measles,15,00,08-07-23,to,house survey,was conducted and treated symptomatically.
TR/AGT/2023/30/859,Tripura,Sepahijala,Dengue,259,00,18-07-23,RRT,investigated the,outbreak. House to house survey was
BH/MZP/2022/45/875,Bihar,Muzaffarpur,Dengue,02,00,03-11-22,8-11-22,Under Control,
KN/DVA/2022/45/878,Karnataka,Davangere,Diarrheal,63,00,07-11-22,07-11-22,drinking. No,enteropathogenic organism was
KN/KOD/2022/45/879,Karnataka,Kodagu,Diphtheria,01,01,03-11-22,07-11-22,Under Control,
KN/KPP/2022/45/880,Karnataka,Koppal,Cholera,41,00,05-11-22,08-11-22,"samples, one",sample was found positive for
KL/KTM/2022/45/885,Kerala,Kottayam,Poisoning,37,00,09-11-22,14-11-22,were found,positive for E.coli. Stool samples
KL/PLK/2022/45/888,Kerala,Palakkad,Diarrheal,21,00,13-11-22,16-11-22,Under Control,
TN/TNJ/2022/45/890,Tamil,Nadu,Thanjavur,22,00,10-11-22,10-11-22,Under Control,District RRT investigated the outbreak. Cases
TN/TNJ/2022/45/891,Tamil,Nadu,Thanjavur Diarrheal,15,00,09-11-22,09-11-22,Under Control,isolated in blood samples. Out of five water
KL/MLP/2022/45/893,Kerala,Malappuram,Measles,21,00,19-10-22,Eight,blood samples,were collected and sent to PH Lab
UK/DEH/2022/45/894,Uttarakhand,Dehradun,Chikungunya,423,00,13-10-22,lab,analysis to,Govt. Doon Medical College and of
VBD.,The,case,a,2,4,months,old,female,
AS/SNT/2023/31/870,Assam,Sonitpur,Mumps,06,00,28-07-23,31-07-23,ELISA. All,cases were vaccinated. The
BH/JAH/2023/31/871,Bihar,Jehanabad,Diarrheal,06,00,04-08-23,04-08-23,showed growth,of E.coli. Affected age group
GJ/PAT/2023/31/874,Gujarat,Patan,Dengue,40,00,03-08-23,04-08-23,of which,13 were found to be NS1 ELISA
KN/RCR/2023/31/880,Karnataka,Raichur,Diarrheal,15,00,02-08-23,04-08-23,RRT investigated,the outbreak. Community
MH/AGB/2023/31/884,Maharashtra,Aurangabad,Dengue,11,00,03-08-23,03-08-23,outbreak. Community,awareness and health
OR/BSR/2023/31/891,Odisha,Baleshwar,Diarrheal,18,00,02-08-23,03-08-23,growth was,"found. 2 water samples were tested,"
OR/BAG/2023/31/892,Odisha,Bargarh,Diarrheal,15,00,03-08-23,03-08-23,normal. District,RRT investigated the
OR/BAG/2023/31/893,Odisha,Bargarh,Diarrheal,13,00,01-08-23,01-08-23,for water,samples & Growth of E.coli in rectal
JH/RMG/2023/31/905,Jharkhand,Ramgarh,Diarrheal,10,00,16-07-23,had,history of,consumption of Prasad in a social gathering.
JH/SBG/2023/31/906,Jharkhand,Sahebganj,Dengue,286,01,22-07-23,investigated,the outbreak.,Regular house to house fever survey
KL/ERN/2023/31/907,Kerala,Ernakulam,Food Poisoning,31,00,25-07-23,Water,samples were,"collected and sent to RPH Lab Ernakulam,"
PD/PON/2023/31/908,Puducherry,Pondicherry,Dengue,15,00,25-07-23,NS1Ag,and 27,samples tested at Arupadaiveedu medical
TN/MDR/2023/31/909,Tamil,Nadu,Madurai Hepatitis A,137,00,15-07-23,Serum,& 22,"Water samples were sent to DPHL, Madurai, out"
HR/JND/2023/32/914,Haryana,Jind,Dengue,17,00,10-08-23,10-08-23,Cases were,treated symptomatically. Out of 17
JK/BGM/2023/32/916,Badgam,Hepatitis,A,38,01,01-08-23,10-08-23,samples 8,came positive for IgM HAV and 4
JH/LOH/2023/32/920,Jharkhand,Lohardaga,Chickenpox,07,00,11-08-23,11-08-23,cases. All,5 samples came positive for IgM
KN/CHI/2023/32/922,Karnataka,Chitradurga,Diarrheal,21,00,12-08-23,12-08-23,outbreak. One,water sample found unfit for
MG/WGH/2023/32/928,Meghalaya,West,Garo Hills,27,00,08-08-23,08-08-23,cases diagnosed,as Typhoid by WIDAL test at
NG/WOR/2023/32/929,Nagaland,Wokha,Dengue,165,00,07-08-23,09-08-23,available result,came positive for IgM Dengue
OR/SBP/2023/32/931,Odisha,Sambalpur,Diarrheal,92,00,11-08-23,12-08-23,RRT investigated,the outbreak. Cases were of
RJ/JWR/2023/32/932,Rajasthan,Jhalawar,Cholera,78,00,11-08-23,12-08-23,outbreak. 7,out of 24 samples found positive
RJ/JWR/2023/32/933,Rajasthan,Jhalawar,Diarrheal,28,00,11-08-23,12-08-23,symptoms after,consumption of mid-day meal
