Unique_ID,State,District,Disease,Cases,Deaths,Start_Date,Report_Date,Status,Comments
KN/TUM/2021/37/0466,Karnataka,Tumkur,Chikungunya,63,00,18-08-21,Of,"these, it",was found that 4 samples were positive for
UP/KAJ/2021/37/0468,Uttar,Pradesh,Kannauj Dengue,11,00,31-08-21,to,be positive,for Dengue by IgM ELISA. District RRT
BH/BUX/2019/26/0734,Bihar,Buxar,Measles,09,00,20-06-19,29-06-19,"samples collected,",sent to WHO lab; result
CT/RGN/2019/26/0735,Chhattisgarh,Rajnandgaon,Diarrheal,39,00,21-06-19,24-06-19,Rajnandgaon; result,awaited. Cases treated
JH/LAT/2019/26/0741,Jharkhand,Latehar,Measles,13,00,24-06-19,25-06-19,RIMS Ranchi;,result awaited. All cases treated
JH/WSI/2019/26/0742,Jharkhand,West,Singhbhum,12,00,28-06-19,29-06-19,symptoms with,loose motion and vomiting. Out
JH/WSI/2019/26/0743,Jharkhand,West,Singhbhum Malaria?,49,00,25-06-19,27-06-19,sample was,positive for malaria (P. falciparum).
MH/GAD/2019/26/0746,Maharashtra,Godchiroli,Diarrheal,11,00,24-06-19,25-06-19,and sent,to SDL Chamorshi; 2 samples were non
MH/RTG/2019/26/0748,Maharashtra,Ratnagiri,Diarrheal,26,00,26-06-19,28-06-19,sent to,SDH Kamathe were non potable for
MN/IMP/2019/26/0751,Manipur,West,Imphal,03,00,28-06-19,30-06-19,and 4,blood samples collected and sent to SRL
CT/RPR/2019/26/0763,Chhattisgarh,Raipur,Diarrheal,39,00,17-06-19-,collected,and sent,to JNM Medical College; were not potable.
JH/LOH/2019/26/0765,Jharkhand,Lohardaga,Measles,05,00,01-06-19,samples,"collected, sent",to RIMS Ranchi; result awaited. All
KN/CKR/2019/26/0769,Karnataka,Chickaballapura,Fever,26,00,19-06-19,outbreak.,2 serum,samples sent to SSL and 2 blood sample
KN/HAV/2019/26/0770,Karnataka,Haveri,Dengue,33,00,18-06-19,sent,to KIMS;,1 sample was positive for Dengue (IgM
KN/KOL/2019/26/0771,Karnataka,Kolar,Chikungunya,23,00,07-06-19,(IgM,ELISA) &,2 samples were positive for Leptospirosis.
AP/KUR/2022/22/350,Nandyal,Food,Poisoning,13,2,31-05-2022,02-06-2022,Under Control,source of water was found bacteriologically
AS/BKA/2022/22/351,Assam,Baksa,Diarrheal,15,00,31-05-2022,31-05-2022,Under Control,District RRT investigated the outbreak and house
AS/BON/2022/22/352,Assam,Bongaigaon,Food Poisoning,20,00,04-06-2022,04-06-2022,Under Control,
AS/BON/2022/22/353,Assam,Bongaigaon,Food Poisoning,19,00,03-06-2022,03-06-2022,Under Control,
CT/JAN/2022/22/354,Chhattisgarh,Food,Poisoning,53,0,02-06-2022,03-06-2022,Under Control,
GJ/COU/2022/22/355,Gujarat,Chhota,Udepur Diarrheal,203,00,29-06-2022,04-06-2022,Under Control,outbreak. House to house survey in the affected
HR/MWT/2022/22/357,Haryana,Nuh,Measles,18,00,23-05-22,06-06-22,Under Control,
KN/GUL/2022/22/359,Karnataka,Kalaburagi,Diarrheal,16,00,01-06-22,03-06-22,Under Control,isolated from any of the samples. District RRT
KN/MYS/2022/22/360,Karnataka,Mysuru,Diarrheal,41,00,30-05-2022,02-06-2022,Under Control,
KN/RCR/2022/22/361,Karnataka,Raichur,Diarrheal,321,03,29-05-22,30-05-22,Under Control,"to DSL, Raichur for bacteriological analysis and"
KN/BIJ/2022/22/362,Karnataka,Vijayapura,Chikungunya,13,00,01-06-2022,01-06-2022,Under Control,
KL/ALP/2022/22/363,Kerala,Alappuzha,Diarrheal,09,00,27-05-22,01-06-22,Under Control,
KL/KAS/2022/22/364,Kerala,Kasaragod,Food Poisoning,22,00,02-06-22,06-02-22,Enteropathogenic organism,in it. District RRT
KL/KTM/2022/22/365,Kerala,Kottayam,Food Poisoning,11,00,05-06-22,06-06-22,Norovirus G2,and one sample was found positive
MH/GAD/2022/22/371,Maharashtra,Gadchiroli,Malaria,196,0,29-05-2022,31-05-2022,Under Control,
MH/GAD/2022/22/372,Maharashtra,Gadchiroli,Malaria,114,1,29-05-2022,30-05-2022,Under Control,District RRT investigated the outbreak and fever
MH/NAG/2022/22/373,Maharashtra,Nagpur,Diarrheal,41,00,01-06-2022,02-06-2022,Under Control,
MH/PNE/2022/22/374,Maharashtra,Pune,Diarrheal,97,00,20-05-2022,31-05-2022,Under Control,and house to house survey was conducted. All
MH/STA/2022/22/375,Maharashtra,Satara,Chikungunya,5,00,31-05-2022,31-05-2022,Under Control,
OR/BAR/2022/22/377,Odisha,Boudh,Food Poisoning,10,00,02-06-22,05-06-22,Under Control,
TN/VIL/2022/22/381,Tamil,Nadu,Kallakurichi Diarrheal,40,00,30-05-22,31-05-22,bacteriological analysis,and eight out of nine
TN/VIL/2022/22/382,Tamil,Nadu,Kallakurichi Diarrheal,40,0,30-05-2022,30-05-2022,Under Control,
TN/PUD/2022/22/383,Tamil,Nadu,Pudukkottai Food Poisoning,17,00,31-05-2022,31-05-2022,Under Control,Aranthangi and all were found negative for
TN/PUD/2022/22/384,Tamil,Nadu,Pudukkottai Food Poisoning,28,00,31-05-22,31-05-22,Under Control,Medical College and both were found not suitable
TN/TNJ/2022/22/385,Tamil,Nadu,Thanjavur Diarrheal,9,0,03-06-2022,04-06-2022,Under Control,
TN/TVR/2022/22/386,Tamil,Nadu,Thiruvarur Food Poisoning,67,0,28-05-2022,01-06-2022,Under Control,for potable purpose. District RRT investigated the
UP/LKW/2022/22/388,Uttar,Pradesh,Lucknow Chickenpox,5,0,01-06-2022,02-06-2022,Under Control,
UP/SID/2022/22/389,Uttar,Pradesh,Diarrheal,30,01,31-05-22,06-06-22,Under Control,investigated the outbreak and house to house
Suspected,Under,The,most affected age group was,5,9,years.,12,,
KL/TRC/2022/05/019,Kerala,Thrissur,Kala Azar,01,00,04-01-22,08-02-22,anorexia. Bone,Marrow Biopsy shows
KL/PLK/2022/05/021,Kerala,Palakkad,Food Poisoning,61,00,02-02-22,07-02-22,Under Control,to Alappuzha Medical College for further
TL/MUD/2022/05/022,Telangana,Narayanpet,Food Poisoning,91,00,06-02-22,07-02-22,Under Control,
UP/FAT/2022/05/023,Uttar,Pradesh,Fatehpur Encephalitic,01,00,24-01-22,05-02-22,Under Control,
PN/PON/2021/09/0105,Puducherry,Puducherry,Dengue,11,00,01-03-21,01-03-21,which 11,tested positive for Dengue by IgM
TN/PER/2021/09/0106,Tamil,Nadu,Peramballur Diarrheal,14,00,06-03-21,06-03-21,analysis and,"was found negative for Cholera,"
KL/ERN/2021/09/0111,Kerala,Ernakulam,Diarrheal,26,00,24-02-21,for,lab. analysis,and shigella sonnii was identified in both the
KL/ERN/2021/09/0112,Kerala,Ernakulam,Shigella,03,00,24-02-21,both,the samples,showed the growth of Shiegella. 02 water
KL/KOZ/2021/09/0113,Kerala,Kozhikode,Shigellosis,03,00,26-02-21,Water,samples were,collected from 06 wells for
AR/UPS/2019/37/1173,Upper,Subansiri,Diarrheal,27,00,10-09-19,13-09-19,tap. A,total of 02 stool samples were collected
HR/PCH/2019/37/1174,Haryana,Panchkula,Cholera,108,02,10-09-19,17-09-19,positive for,cholera. A total of 18 stool samples
KN/GUL/2019/37/1178,Karnataka,Kalaburagi,Chikungunya,23,00,11-09-19,12-09-19,treated symptomatically.,Fever survey done.
KN/RNA/2019/37/1179,Karnataka,Ramanagara,PUO,19,00,12-09-19,13-09-19,collected and,"sent to PHI, Bangalore and 04"
PB/HRP/2019/37/1185,Punjab,Hoshiarpur,Cholera,123,01,14-09-19,14-09-19,V. Cholera,and 03 were positive for Shigella.
MH/THN/2019/37/1195,Maharashtra,Thane,Dengue,06,01,30-08-19,positive,for Dengue,by IgM. A total of 05 blood samples were
SK/SOU/2019/37/1198,Sikkim,South,Sikkim Dengue,92,00,04-09-19,STNM,"Hospital (DPHL),",Gangtok; 92 tested positive for
Cases,were,mostly,above,15,03,of,the,cases,
AS/NGO/2021/33/0393,Assam,Nagaon,Encephalitis,01,01,10-08-21,16-08-21,"GNRC Lab,","Guwahati for further investigation,"
HR/KMN/2021/33/0394,Haryana,Karnal,Diarrheal,26,00,22-08-21,22-08-21,Under Control,result is awaited. Six water samples were sent to
JH/GDA/2021/33/0395,Jharkhand,Godda,Diarrheal,38,00,20-08-21,20-08-21,investigated the,outbreak. Health education was
MH/CND/2021/33/0396,Maharashtra,Chandrapur,Malaria,07,03,07-08-21,17-08-21,"Gunjewahi, Taluk","Sindewahi, District"
MH/STA/2021/33/0397,Maharashtra,Satara,Hepatitis A,19,00,10-08-21,17-08-21,for further,"lab analysis, the samples tested"
MH/THN/2021/33/0398,Maharashtra,Thane,Dengue,05,00,17-08-21,20-08-21,samples were,"sent to Civil Hospital Thane, the"
MH/YVT/2021/33/0399,Maharashtra,Yavatmal,Food Poisoning,40,00,16-08-21,18-08-21,Under Control,
UP/LKW/2021/33/0401,Uttar,Pradesh,Lucknow Diarrheal,73,00,16-08-21,17-08-21,Under Control,
WB/NCP/2021/33/0403,West,Bengal,Basirhat Diarrheal,37,00,17-08-21,18-08-21,collected and,sent to NICED for further lab
TN/DDG/2021/23/0217,Tamil,Nadu,Dindigul Palani Diphtheria,01,00,05-06-21,14-06-21,and Noisy,breathing. 01 Throat sample was
KL/KOZ/2021/23/0219,Kerala,Kozhikode,Dengue,64,00,11-05-21,further,lab analysis,and they tested positive for Dengue by
KL/THI/2021/23/0220,Kerala,Trivandrum,Chikungunya,10,00,14-05-21,"analysis,",the samples,tested positive for Chikungunya by
WB/SPG/2021/23/0222,West,Bengal,Harbour Health Diarrheal,289,00,16-04-21,"Rajballavpur,","Nazra, Sherpur,","Dogacha, Rangilabad."
GJ/SBK/2020/25/350,Gujarat,Sabarkantha,Diarrhoeal,08,00,12-06-20,17-06-20,Illol village.,A total of 03 stool samples collected
KL/CNR/2020/25/352,Kerala,Kannur,Dengue,174,02,03-06-20,Dengue,NS1 abnd,IgM positive. Cases reported from 10
KL/CNR/2020/25/353,Kerala,Kannur,Dengue,94,02,08-06-20,"GMC,",Kannur and,"46y/M presented with fever, bodyache and"
KL/KOZ/2020/25/354,Kerala,Kozhikode,Dengue,30,00,20-01-20,of,31 samples,collected and sent to TH Perambra abd all were
MH/GAD/2022/02/004,Maharashtra,Gadchiroli,Malaria,07,02,10-01-22,14-01-22,"analysis, out",of which seven samples tested
BH/BHJ/2020/12/0250,Bihar,Bhojpur,Chickenpox,28,00,25-02-20,16-03-20,35 years.,A total of 05 blood serum and 01 throat
BH/BUX/2020/12/0251,Bihar,Buxar,Chickenpox,21,00,10-03-20,19-03-20,case search,conducted. Cases presented with
BH/KTH/2020/12/0252,Bihar,Katihar,Chickenpox,17,00,26-02-20,20-03-20,investigated the,outbreak. Cases presented with
KN/RCR/2020/12/0254,Karnataka,Raichur,Dengue,15,00,16-03-20,17-03-20,and sanitation,observed. A total of 15 serum
WB/NDA/2020/12/0255,West,Bengal,Nadia,40,00,19-03-20,20-03-20,conducted. A,"total of 05 rectal swab, food"
AP/CDP/2022/34/653,YSR,Kadapa,Dengue,04,00,23-08-2022,26-08-2022,Under Control,"Laboratory, RIMS Kadapa out of which four"
CT/BBR/2022/34/654,Chhattisgarh,Balodabazar,Diarrheal,32,00,25-08-2022,26-08-2022,Under Control,
CT/MHN/2022/34/655,Chhattisgarh,Mahasamund,Diarrheal,20,00,24-08-2022,25-08-2022,Under Control,District Hospital Pandri Raipur where four
GJ/AND/2022/34/656,Gujarat,Anand,Diarrheal,39,00,25-08-2022,25-08-2022,Under Control,
KN/HAS/2022/34/658,Karnataka,Hassan,Diarrheal,21,00,21-08-22,22-08-22,Under control,
KN/KRW/2022/34/659,Karnataka,Uttara,Kannada Leptospirosis,01,01,26-08-22,26-08-22,Under control,Uttar Kannada and was positive for
KL/TRC/2022/34/662,Kerala,Thrissur,phalitis,01,01,22-08-22,30-08-22,Under Control,
MP/KAT/2022/34/664,Katni,Scrub,Typhus,08,00,23-08-2022,28-08-2022,Under Control,team formed and rapid fever survey of
MP/RJG/2022/34/665,Rajgarh,Swine,Flu,01,01,20-08-2022,26-08-2022,Under Control,
MH/NAS/2022/34/669,Maharashtra,Nashik,Cholera,10,02,24-08-2022,26-08-2022,Under Control,District RRT investigated the outbreak.
MH/YVT/2022/34/670,Maharashtra,Yavatmal,Diarrheal,12,00,25-08-2022,26-08-2022,Under Control,chloerae (culture) at VNGMC YAVATMAL.
OR/CUT/2022/34/671,Odisha,Cuttack,Diarrheal,16,00,22-08-22,24-08-22,Under Control,
OR/CUT/2022/34/672,Odisha,Cuttack,Hepatitis A,13,00,23-08-22,24-08-22,Under Control,Cuttack where 13 blood samples tested
OR/KPT/2022/34/673,Odisha,Koraput,Diarrheal,07,00,21-08-22,22-08-22,Under Control,
OR/KJR/2022/34/674,Odisha,Keonjhar,Diarrheal,43,00,23-08-22,24-08-22,Under Control,
PB/HRP/2022/34/675,Punjab,Hoshiarpur,Diarrheal,13,00,20-08-2022,27-08-2022,Under Control,
UK/DEH/2022/34/676,Uttarakhand,Dehradun,Diarrheal,19,00,29-07-2021,24-08-2022,Under Control,Bacteria whereas stool culture tested negative
UK/NAI/2022/34/677,Uttarakhand,Nainital,Measles,06,00,22-08-22,29-08-22,collected and,result awaited. District RRT
AS/UAL/2019/48/1565,Assam,Udalguri,Diarrheal,09,01,26-11-19,28-11-19,and presented,symptoms of loose motion and
GJ/BNS/2019/48/1568,Gujrat,Banaskantha,Measles,06,00,28-11-19,28-11-19,Active search,of cases done. Serum samples
KN/CKR/2019/48/1573,Karnataka,Chikkaballapur,Dengue,25,00,26-11-19,29-11-19,survey done.,1 blood sample collected and sent to
KN/GUL/2019/48/1574,Karnataka,Kalaburagi,Diarrheal,12,00,27-11-19,28-11-19,done. 2,stool sample collected were negative for
MH/KOP/2019/48/1575,Maharashtra,Kolhapur,Chikungunya,08,00,25-11-19,27-11-19,sent to,"SSH, CPRH Hospital, Kolhapur; were"
OR/GJM/2019/48/1576,Odisha,Ganjam,Diarrheal,13,00,22-11-19,25-11-19,done. 02,rectal swab rectal and 04 water samples
OR/MBJ/2019/48/1578,Odisha,Mayurbhanj,Diarrheal,09,00,26-11-19,28-11-19,done. 07,rectal swab rectal and 01 water samples
PB/BTD/2019/48/1579,Punjab,Bathinda,Chickenpox,07,00,30-11-19,30-11-19,District RRT,investigated the outbreak. Active
PB/FER/2019/48/1580,Punjab,Ferozepur,Chickenpox,25,0,30-11-19,30-11-19,investigated the,outbreak. Active search of cases
PB/FKT/2019/48/1582,Punjab,Faridkot,Mumps,07,00,26-11-19,30-11-19,blood samples,collected were positive for Mumps
PB/PTL/2019/48/1583,Punjab,Patiala,Measles,08,00,29-11-19,30-11-19,samples collected,"and send to DPHL, Patiala."
AS/GLG/2019/48/1585,Assam,Golaghat,Chickenpox,06,00,18-11-19,investigated,the outbreak.,Active search of cases done. Cases
DL/DLS/2019/48/1587,Delhi,South,Delhi Dengue,12,00,21-10-19,Super,Specialty Hospital,were positive for Dengue (IgM
OR/JAJ/2019/48/1593,Odisha,Jajpur,Chikungunya,60,00,10-11-19,house,survey done.,8 blood samples collected. All cases treated
GJ/VAD/2021/31/0351,Gujarat,Vadodara,Cholera,03,00,31-07-21,09-08-21,Under Control,"Eight water samples were sent to SSG Hospital,"
HR/PCH/2021/31/0352,Haryana,Karnal,Diarrheal,36,00,09-08-21,16-08-21,Under Control,
HR/YNN/2021/31/0353,Haryana,Yamuna,Nagar Cholera,21,00,03-08-21,09-08-21,Under Control,
HR/YNN/2021/31/0354,Haryana,Yamuna,Nagar Diarrheal,21,00,03-08-21,09-08-21,Under Control,
JH/WSI/2021/31/0356,Jharkhand,West,Singhbhum Viral Fever,64,00,02-08-21,04-08-21,Under Control,"for malaria & COVID-19, out of which only one"
MH/CND/2021/31/0359,Maharashtra,Chandrapur,Malaria,01,01,03-08-21,07-08-21,chills. Blood,sample was sent for lab analysis
MH/GAD/2021/31/0361,Maharashtra,Gadchiroli,Malaria,28,01,31-07-21,02-08-21,Under Control,
MH/KOP/2021/31/0362,Maharashtra,Kolhapur,Chikungunya,06,00,02-08-21,04-08-21,analysis to,"Sentinel Centre, Kolhapur and out of"
MH/THN/2021/31/0364,Maharashtra,Thane,Leptospirosis,02,02,28-06-21,05-08-21,Under Control,
PB/SUR/2021/31/0365,Punjab,Sangrur,Diarrheal,68,00,13-08-21,14-08-21,Under Control,
MH/RGD/2021/31/0371,Maharashtra,Raigad,Dengue,18,00,11-06-21,to,Thane Civil,Sentinel Centre and all of them were found
MH/STA/2021/31/0372,Maharashtra,Satara,Chikungunya,20,00,14-07-21,were,sent to,NIV Pune and all of them were found positive
MH/WDH/2021/31/0374,Maharashtra,Wardha,Dengue,04,00,07-06-21,"bodyache,",vomiting and,headache. Ten samples were sent
CT/RGR/2022/27/514,Chhattisgarh,Raigarh,Diarrheal,27,00,07-07-2022,10-07-2022,Completed potable,purpose. District RRT investigated the
HR/KTL/2022/27/515,Haryana,Kaithal,Hepatitis A,13,00,07-07-22,13-07-22,Under Control,
HR/MWT/2022/27/516,Haryana,Nuh,Measles,08,00,06-07-22,07-07-2022,Completed outbreak.,Cases were isolated. Frequent changes
KN/BIJ/2022/27/521,Karnataka,Vijayapura,Diarrheal,54,00,03-07-22,04-07-22,Completed suitable,for potable purpose. Out of eight stool
MH/CND/2022/27/522,Maharashtra,Chandrapur,Diarrheal,45,0,04-07-2022,05-07-2022,Completed purpose.,District RRT investigated the outbreak
OR/SON/2022/27/523,Odisha,Subarnapur,Diarrheal,24,00,04-07-22,11-07-22,Under Control,
OR/SUN/2022/27/524,Odisha,Sundargarh,Food Poisoning,108,00,05-07-22,06-07-22,Under Control,
UK/RDP/2022/27/528,Uttarakhand,Rudraprayag,Diarrheal,12,00,04-07-22,10-07-22,found unfit,for drinking. District RRT
UP/RBL/2022/27/529,Uttar,Pradesh,Rae Bareli Chickenpox,25,00,02-07-2022,07-07-2022,Completed,
JH/SIM/2022/27/530,Jharkhand,Simdega,Malaria,148,1,28-06-2022,Completed,collected from,the related village for Malaria test. All the
KL/ERN/2022/27/531,Kerala,Ernakulam,Dengue,85,00,27-06-22,District,RRT investigated,the outbreak and fever survey
KL/TRC/2022/27/532,Kerala,Thrissur,Shigella,01,00,01-07-22,Thrissur,and was,found positive for Shigella Sonnei
KL/KOA/2022/27/533,Kerala,Kollam,Dengue,42,00,16-06-22,found,positive for,Dengue by IgM ELISA. District RRT
MZ/AIZ/2022/27/536,Mizoram,Aizawl,Diarrheal,24,0,22-06-2022,Completed,District RRT,investigated the outbreak and house to house
OR/JHA/2022/27/537,Odisha,Jharsuguda,Diarrheal,21,1,28-01-2022,Completed,found not,suitable for potable purpose. The deceased case
TN/TVR/2022/27/538,Tamil,Nadu,Thiruvarur Food Poisoning,12,00,25-06-2022,Completed,,
KN/RCR/2021/03/0016,Karnataka,Raichur,Diarrheal,13,00,20-01-20,21-01-20,RRT investigated,the outbreak. House to house
KN/CKR/2021/03/0017,Karnataka,Chickaballapura,Diarrheal,61,00,24-01-21,24-01-21,commensal. Water,samples collected and sent to
KN/BGK/2021/03/0018,Karnataka,Bagalkot,Chikungunya,18,00,17-01-21,18-01-21,sent to,"DPHL, Bagalkote. were positive for"
KN/BEL/2021/03/0019,Karnataka,Ballari,Diarrheal,18,01,20-01-21,21-01-21,water samples,"sent to DSU, Bellary; 7 samples"
MH/GAD/2021/03/0022,Maharashtra,Gadchiroli,Malaria,02,01,20-01-21,21-01-21,search of,cases done. Out of 2 blood smear were
PB/PTL/2021/03/0023,Punjab,Patiala,Diarrheal,41,00,18-01-21,19-01-21,PHE Dept.,Stools samples collected. All cases
CT/BBR/2019/33/1013,Chhattisgarh,Balodabazar,Diarrheal,39,00,11-08-19,13-08-19,observed that,villagers used unsafe water from
OR/BSR/2019/33/1021,Odisha,Balasore,Diarrheal,17,00,16-08-19,17-08-19,loose stools,and pain abdomen. All cases were
WB/PRL/2019/33/1028,West,Bengal,Purulia Diarrheal,35,00,15-08-19,15-08-19,age. A,total of 02 stool samples (Rectal Swab)
PB/AMT/2019/33/1036,Punjab,Amritsar,Hepatitis E,24,00,09-08-19,"samples,",06 samples,were positive for Hepatitis E by Ig M
TN/MDR/2019/33/1037,Tamil,Nadu,Madurai Chikungunya,32,00,07-08-19,collected,and sent,to DPHL Madurai and all found positive
JH/GDA/2022/17/172,Jharkhand,Godda,Measles,14,00,24-04-22,28-04-22,samples tested,positive for Measles. The
KN/HAS/2022/17/173,Karnataka,Hassan,Diarrheal,40,00,24-04-22,Under,Control enteropathogenic,microorganism were found in
KN/KOD/2022/17/174,Karnataka,Kodagu,Food Poisoning,50,00,28-04-22,Under,Control,
KL/CNR/2022/17/177,Kerala,Kannur,Food Poisoning,26,00,24-04-22,27-04-22,Laboratory and,showed presence of coliforms
OR/GAJ/2022/17/179,Odisha,Gajapati,Chicken Pox,25,00,29-04-22,02-05-22,Under Control,"Berhampur, Ganjam. For IgM ELISA and one"
OR/GJM/2022/17/180,Odisha,Ganjam,Diarrheal,29,00,26-04-22,28-04-22,Under Control,
OR/JAJ/2022/17/181,Odisha,Jajpur,Food Poisoning,41,00,02-05-22,03-05-22,for bacteriological,analysis. Both of the samples
OR/KLN/2022/17/182,Odisha,Nuapada,Food Poisoning,100,00,28-04-22,29-04-22,Under Control,the outbreak and all of the cases were given
RJ/PAL/2022/17/183,Rajasthan,Pali,Food Poisoning,42,00,27-04-22,28-04-22,Under Control,outbreak. All of cases were given symptomatic
RJ/SRH/2022/17/184,Rajasthan,Sirohi,Encephalitis,12,07,22-04-22,23-04-22,Under Control,to SMS Jaipur. The blood sample showed
TN/KRI/2022/17/186,Tamil,Nadu,Krishnagiri Food Poisoning,11,00,29-04-22,30-04-22,found to,be potable. Three stool samples were
TN/MDR/2022/17/187,Tamil,Nadu,Madurai Chickenpox,05,00,26-04-22,29-04-22,outbreak. House,to house survey of vesicular
WB/HWR/2022/17/188,West,Bengal,Howrah Food Poisoning,120,00,02-05-22,03-05-22,,
CT/KAW/2019/39/1238,Chhattisgarh,Kawardha,Diarrheal,06,00,23-09-19,27-09-19,investigated the,outbreak. Water chlorination
JH/BOK/2019/39/1241,Jharkhand,Bokaro,Dengue,06,00,20-09-19,27-09-19,06 blood,serum samples collected and tested at
JH/WSI/2019/39/1242,Jharkhand,West,Singhbhum Malaria,63,00,23-09-19,26-09-19,rigor and,vomiting. A total of 690 samples
JH/WSI/2019/39/1243,Jharkhand,West,Singhbhum,04,00,25-09-19,28-09-19,altered sensorium.,A total of 04 samples collected
KN/TUM/2019/39/1245,Karnataka,Tumkur,Influenza B,31,00,21-09-19,23-09-19,throat and,cough. A total of 04 throat swab samples
KN/YDI/2019/39/1246,Karnataka,Yadgiri,Chikungunya,09,00,22-09-19,23-09-19,blood samples,collected and tested at DPHL
MH/KOP/2019/39/1250,Maharashtra,Kolhapur,Dengue,06,00,25-09-19,27-09-19,"CPRH Hospital,",Kolhapur; 03 samples were
MH/NDB/2019/39/1252,Maharashtra,Nandurbar,Dengue,26,02,21-09-19,25-09-19,informed. Fever,survey done. A total of 03 serum
OR/SUN/2019/39/1256,Odisha,Sundargarh,Anthrax?,03,00,20-09-19,28-09-19,smear slide,"collected and tested at DPHL,"
OR/KHU/2019/39/1257,Odisha,Khordha,Diarrheal,09,01,19-09-19,26-09-19,to SCB,"MCH, Cuttak; 02 water samples found non"
PB/SAS/2019/39/1258,Punjab,SAS,Nagar Diarrheal,129,00,28-09-19,29-09-19,symptomatically. Medical,camp organized in the
RJ/BAA/2019/39/1260,Rajasthan,Baran,Diarrheal,48,00,26-08-19,24-09-19,samples and,06 water samples were tested at
AS/LKM/2019/39/1263,Assam,Lakhimpur,Hepatitis A,02,00,09-09-19,samples,were positive,for Hepatitis A by IgM ELISA. A total
MP/UIJ/2019/39/1267,Ujjain,Food,poisoning,14,00,17-09-19,age,group 14-22,years. Water and food samples were collected
MH/PNE/2019/39/1269,Maharashtra,Pune,Dengue,44,00,01-09-19,house,survey done.,A total of 52 samples collected and tested
the,outbreak.,A,total of,04,03,water,samples,,
HR/FBD/2021/11/0128,Haryana,Faridabad,Chickenpox,05,00,18-03-21,22-03-21,for lab.,"analysis, one sample tested positive for"
JH/WSI/2021/11/0130,Jharkhand,West,Singhbhum Chickenpox,08,00,18-03-21,19-03-21,Cases presented,with fever and Macula-popular
MG/WKH/2021/11/0132,Meghalaya,West,Khasi Hills Diarrheal,37,00,12-03-21,17-03-21,,
WB/PRL/2021/11/0133,West,Bengal,Puruliya Diarrheal,255,00,16-03-21,17-03-21,Vomitus samples,and 07 stool samples were
The,deceased,were,a,32,60,year,old,male who,
MH/AMN/2020/29/377,Tamil,Nadu,Ariyalur Diarrhoeal,18,00,13-07-20,13-07-20,the affected,area. A total of 05 water and 02 stool
MH/AMN/2020/29/378,Tamil,Nadu,Namakkal Hepatitis A,16,00,19-07-20,22-07-20,total of,11 serum samples were collected and sent
MH/AMN/2020/29/383,Kerala,Kozhikode,Dengue,20,00,15-06-20,74,years of,"age, 15 male and 05 were female. A total of 20"
AS/GLP/2022/37/725,Assam,Goalpara,Diarrheal,04,00,16-09-22,16-09-22,Under Control,
GJ/AND/2022/37/726,Gujarat,Anand,Diarrheal,10,00,11-09-22,15-09-22,Under Control,microbiological examination at petlad civil
JH/SBG/2022/37/728,Jharkhand,Sahebganj,Diarrheal,20,00,10-09-22,13-09-22,Under Control,consumed drinking water from an unprotected
KN/KRW/2022/37/731,Karnataka,Uttara,Kannada Leptospirosis,01,01,12-09-22,15-09-22,Under control,
KN/KRW/2022/37/732,Karnataka,Uttara,Kannada Leptospirosis,01,01,14-09-22,16-09-22,Under control,
TL/WRG/2022/37/736,Telangana,Warangal,Diarrheal,33,00,05-09-22,12-09-22,Under Control,treatment given. Investigated by RRT Team.
UK/RDP/2022/37/737,Uttarakhand,Rudra,Prayag Diarrheal,12,00,08-09-22,12-09-22,Under Control,detected in blood and water samples. District
CT/GID/2022/37/740,Chhattisgarh,Gariyaband,Diarrheal,11,00,09-09-22,investigated,the outbreak.,Block Surveillance Team
CT/RGN/2022/37/741,Chhattisgarh,Rajnandgaon,Diarrheal,11,00,08-09-22,investigated,the outbreak.,"Door to door survey done,"
HR/RUP/2022/37/744,Haryana,Nuh,Measles,05,00,09-09-22,and,sent to,Maharishi Valmiki Infection Hospital
KL/MLP/2022/37/747,Kerala,Malappuram,Food Poisoning,09,00,04-09-22,vomiting,and loose,stools. One stool sample collected
MZ/AIZ/2022/37/748,Mizoram,Aizawl,Diarrheal,16,00,01-09-22,Raw),sent to,Civil Hospital Microbiology Laboratory
WB/MDN/2020/51/513,West,Bengal,Purba Medinipur Scrub Typhus,23,00,11-02-20,15-11-20,,
AS/TIN/2020/51/514,Assam,Tinsukia,Leptospirosis,01,00,06-12-20,presented,"with high-fever,",diarrhea and vomiting. Blood
MH/JGA/2020/27/361,Maharashtra,Jalgaon,Diarrhoeal,74,00,28-06-20,02-07-20,leakage found,in the affected area. A total of 03
TN/TNJ/2020/27/363,Tamil,Nadu,Thanjavur Diarrhoeal,57,00,04-07-20,05-07-20,observed. A,total of 02 stool and 02 water
CT/DHM/2020/04/0049,Chhattisgarh,Dhamtari,Diarrheal,169,00,17-01-20,24-01-20,outbreak. 14,Stool samples collected and sent to
GJ/MHS/2020/04/0050,Gujarat,Mahesana,Diarrheal,45,00,24-01-20,24-01-20,02 water,samples collected and tested at
MH/KOP/2020/04/0054,Maharashtra,Kolhapur,Dengue,02,01,18-01-20,23-01-20,was a,18y/M. A total of 04 blood samples
OR/KHU/2020/04/0055,Odisha,Khordha,Chickenpox,17,00,23-01-20,27-01-20,District RRT,investigated the outbreak. Active
PB/MOG/2020/04/0057,Punjab,Moga,Mumps,14,00,21-01-20,21-01-20,case search,done. A total of 07 blood samples
TN/AIR/2020/04/0058,Tamil,Nadu,Ariyalur Chickenpox,43,00,25-01-20,26-01-20,Andimadam. Active,case search done. District
TN/SLM/2020/04/0059,Tamil,Nadu,Salem Chickenpox,23,00,23-01-20,27-01-20,"Vellalappatti, Block",Sarakapillaiyur. District RRT
HR/JJH/2020/04/0061,Haryana,Jhajjar,Chickenpox,11,00,09-01-20,District,RRT investigated,the outbreak. All cases treated.
JH/WSI/2020/04/0064,Jharkhand,West,Singhbhum Chickenpox,10,00,15-01-20,total,of 05,blood serum samples collected and sent to DPHL
KN/KOL/2020/04/0065,Karnataka,Kolar,Diphtheria,05,01,16-01-20,hygiene,was observed.,A total of 04 throat swab samples
Under,conducted.,A,total of,02,04,serum,and,02,
Surveillance,the,age,"group 7-8 years, included",08,04,boys.,Cases,,
MH/CND/2020/04/0072,Maharashtra,Chandrapur,Malaria,23,01,16-01-20,blood,smears were,examined and 05 were found to be positive
CT/JAN/2019/24/0635,Chhattisgarh,Janjgir,Diarrheal,24,00,10-06-19,13-06-19,house survey,done. ORS packets and chlorine
GJ/GAN/2019/24/0638,Gujarat,Gandhi,Nagar Cholera,03,00,12-06-19,18-06-19,positive for,cholera culture. Cases treated
KL/CNR/2019/24/0641,Kerala,Kannur,Malaria,03,00,10-06-19,15-06-19,presented symptoms,of fever and later blood smear
KN/GUL/2019/24/0644,Karnataka,Kalaburagi,Diarrheal,40,00,11-06-19,12-06-19,5 samples,were non potable. All 3 stool samples
MH/SGL/2019/24/0646,Maharashtra,Sangli,Malaria,07,00,04-06-19,11-06-19,All the,cases were migrant labours from District
OR/AGL/2019/24/0650,Odisha,Angul,Diarrheal,08,01,11-06-19,14-06-19,rectal swabs,collected; 1 swab showed growth of
